OID	File	Portion	English	廣東話口語（Colloquial Cantonese）v1028
101	Abigail	Introduction	Oh, that's right... I heard someone new was moving onto that old farm.#$e#It's kind of a shame, really. I always enjoyed exploring those overgrown fields by myself.$9	哦，咁就啱嘞，我聽講，有人要搬嗰個老農場去。 #$e#呢有啲可惜，真係。我係中意自己去探索嗰啲雜草叢生嘅田野。$9
102	Abigail	Resort_Entering	I hope a mermaid visits the beach.	我希望有人魚公主嚟探沙灘。
103	Abigail	Resort_Leaving	I'm gonna ask Willy if we can take the scenic route back.	我想問嚇Willy，我可唔可以走風景路線返去。
104	Abigail	Resort_Leaving_2	Maybe we'll see a sea monster on the way back.	或者我地會喺返嚟嘅路上睇到海怪。
105	Abigail	Resort_Shore	The beach is okay, but it gets boring pretty quick. I'd rather check out that dark jungle, or the volcano!	沙灘都唔錯，但好快就會變得，好悶。我寧願去睇下嗰條鼆嘅叢林，或者火山！
106	Abigail	Resort_Shore_2	Hmm, you think I could sneak my guinea pig onto the island?#$e#Nah, David's probably not much of a swimmer anyways.$h	哇，你話我可以將我天竺鼠偷偷帶到島上呀？#$e#不，David可能不怎麼會游泳。$h
107	Abigail	Resort_Umbrella	My skin gets burnt really easily. So I'm just gonna stay under this umbrella for a while.#$e#I like it in the shade. Too much sun makes me dizzy.	我皮膚真係好易畀燒親。所以我就喺呢把遮下一陣間。 #$e#我鍾意喺陰涼處。太多嘅陽光畀我頭暈目眩。
108	Abigail	Resort_Umbrella_2	Hey @, want to build a sand castle with me?#$e#Actually, a sand dungeon might be cooler!$h	嘿 @，想同我一齊切個沙堡嗎？#$e#其實沙地牢可能更有型！ $h
109	Abigail	Resort_Umbrella_3	Hey @, you think you could build a raft?#$e#I saw a few cool islands on the way here I want to visit.	嘿@，你覺得你可唔可以做個木筏嗎？#$e#喺離呢度慨路上我睇咗幾個好有型慨島，我想去睇睇。
110	Abigail	Resort_Wander	An island this big has got to be hiding some buried treasure.#$e#Quick, get me a shovel!#$e#Relax, I'm just kidding.$h	咁大嘅個島肯定收埋啲埋藏嘅寶藏。 #$e#快，畀我將鏟子！ #$e#放鬆啲，我只係講笑。$h
111	Abigail	Resort_Bar	Gus made me a dark purple refresher, to match my hair. It tastes great!$h	Gus畀我做咗個深紫嘅醒神劑，以配合我啲頭髮。味道好嘢！ $h
112	Abigail	Resort	Bummer... Willy says we have to stay on the beach...$s#$b#And I brought my sword and everything...$s	憎……Willy話我哋一定要留喺沙灘上……$s#$b#我重帶咗我架劍同所有嘢……$s
113	Abigail	danceRejection	That's flattering... but I'm gonna have to say no. Sorry.	呢個真係畀人受寵若驚，但我要拎話唔。對唔住。
114	Abigail	divorced	What are you doing here? Just leave me alone!$a	你喺度做咩呀？等我一個人留住！ $a
115	Abigail	dumped_Girls	Don't talk to me!$a	唔好同我講！$a
116	Abigail	secondChance_Girls	*sigh*... I can't stay mad at you anymore, @. Let's just move on with our lives.$s	*透氣*…我唔再繼續對你嬲咗，@。畀我哋繼續我哋嘅生活。$s
117	Abigail	breakUp	Oh... I... I understand. You see me as just a friend...$s#$b#I guess we weren't really a good match...$s	哦……我…我理解。你將我看作只係一個朋友……$s#$b#我想我哋唔係真正嘅對象……$s
118	Abigail	Mon	Oh, hey. Taking a break from work?	哦，嘿嘿。喺嘢之餘休息嚇？
119	Abigail	Mon2	Oh, hi!#$e#Do you ever hang out at the cemetery? It's a peaceful place to spend some time alone.	哦！ #$e#你曾經喺公墓閒逛過咩？呢個系一個寧靜嘅地方，可以獨自度過啲時間。
120	Abigail	Tue	Ugh... I'm not in a good mood right now.$s#$e#I said I'm not in a good mood... what do you want?$a	呃…我而家心情唔好。 $s#$e#我話我心情唔好……你想要咩？ $a
121	Abigail	Tue2	...*sigh*...$s#$e#I know my parents mean well, but sometimes they just cannot understand my point of view. Weren't they ever young?	…*透氣*……$s#$e#我知我阿爸阿媽係好意，但有時，佢哋就唔可以理解我嘅觀點。佢哋唔係曾經好後生嗎？
122	Abigail	Wed	Hey. Sorry in advance if I say anything rude. I didn't get much sleep last night.#$e#What do you want?	嘿，如果我講咗咩唔禮貌嘅話，唔該提前道歉。我尋晚冇乜訓教。 #$e#你想點？
123	Abigail	4	Oh, hi.	哦，你好。
124	Abigail	Thu	#$1 Abigail1#Oh no, I think my Dad's going to cook dinner tonight...$s#$e#I don't feel like doing anything today...$u	#$1 Abigail1#哦，唔好，我諗我阿爸今晚要煮飯……$s#$e#我今日唔想做咩……$u
125	Abigail	Fri	Wow, I just realized it's Friday. $u#$e#Sometimes I totally lose track of time.	哇完全唔知係星期五. $u#$e#有時我完全唔記得咗時間。
126	Abigail	Fri2	We're all going to hang out in the saloon this evening. It's kind of like a friday tradition, I guess.	今晚我哋都要喺沙龍度玩。呢有啲似星期五嘅傳統。
127	Abigail	Sat	The fresh mountain air is nice on a day like this.$h#$e#I wonder if the frogs will make an appearance soon.	喺噉嘅日子企，山里嘅新鮮空氣好好。 $h#$e#我想知青蛙係咪會好快出現。
128	Abigail	Sun	Oh man... I've been pushing off my homework all weekend. Looks like I'll be pulling another all-nighter...$s	哦，伙計…我成個週末都喺推跌我啲功課。睇嚟，我又要通宵$s……
129	Abigail	Sun2	I wonder what would happen if I spent all night in the graveyard?#$q 17/18 Sun_old#@, What do you think happens to us after we die?#$r 17 0 Sun_17#I have no idea.#$r 18 40 Sun_18#We come back as spooky ghosts.#$r 17 0 Sun_17#We go to Heaven.#$r 18 0 Sun_17#Our energy bodies enter the astral plane.#$r 17 30 Sun_nothing#Nothing. We just cease to exist.	我想知，如果我喺墓地度留一晚會發生咩？ #$q 17/18 Sun_old#@，你話我哋死後會發生咩？ #$r 17 0 Sun_17#我唔知.#$r 18 40 Sun_18#我哋扮鬼扮馬#$r 17 0 Sun_17#我哋上天堂#$r 18 0 Sun_17#我們的能量體進入星界。#$r 17 30 Sun_nothing#我哋系唔再存在。
130	Abigail	Sun_old	$p 17#I guess you think nothing would happen, right?$u|Maybe a wicked ghost would appear!	$p 17#我估你認為咩都唔會發生，對呀？ $u|或者一個邪惡嘅幽靈會出現！
131	Abigail	Sun_17	Hmm, interesting...	哇，有意思……
132	Abigail	Sun_18	Well that's an interesting theory!$h	哇，哩個有趣嘅理論！$h
133	Abigail	Sun_nothing	You know, that wouldn't be so bad.$8	你知唔知，咁又唔係咁衰。$8
134	Abigail	Wed2	Oh, hi @. Taking a break from your work?#$e#Me too. Oh! Nothing physical... just some online classes I'm taking.	哦，你好@。由你嘅工作中休息嚇？ #$e#我都係。哦！冇咩實物……只係一啲我喺度嘅在線課程。
135	Abigail	Tue4	Hi, I'm glad to see you.$h#$e#I want to take my mind off things for a while... how is your day going?	餵，我好開心見到你。 $h#$e#我想暫時忘掉我嘅嘢，你今日過得點啊？
136	Abigail	Sat6	You came all this way to visit me? That's nice.$h#$e#So have you been exploring the mountain caves at all?#$e#Interesting. I'd like to go there myself one of these days.$l	你大老遠走嚟探下我？真係好。 $h#$e#咁你有冇去探索過山窿呢？#$e#呢幾日我想自己去果度。 $l
137	Abigail	Mon8	...Oh, @! Hi.$h#$e#Want to hang out for a while? Here! Let me read your palm. *giggle* $h	…哦，@！ $h#$e#想喺出面玩一陣呀？喺呢度！俾我睇嚇你個手板。 *咯咯笑*$h
138	Abigail	Thu10	Hi.$l#$e#Do you feel like everything seems unreal lately?$l#$b#Not in a bad way, though.$h	Hi.$l#$e#你覺得最近慨一切都顯得流啊？ $l#$b#雖然唔係衰。$h
139	Abigail	Fri6	The birds were happily chirping today. They're too simple to understand the future.#$e#It's better to be like them, isn't it?	今日雀仔們開心啖鳴叫住。佢好簡單，唔識未來。 #$e#似佢哋一樣，更加好，唔係咩？
140	Abigail	Event_VideoGame_Yes	Great! I'm sure you'll be able to beat this level with ease.$h	真係好！我相信你一定可以輕鬆啖打贏呢一關。$h
141	Abigail	Event_VideoGame_No	Oh? *sigh*... I guess I'll never get past this level, then...$s	哦，*嚡嚡聲*…我諗我永遠都過唔到呢一關，咁……$s
142	Abigail	Event_Grave1	See? You understand why I'm out here, then.#$b#I've lived in the valley my whole life, but I've never really done anything memorable. I want to go on an adventure!$8	睇到未呀？咁你就明白我點解要離呢度。 #$b#我永世都喺山卡罅入面，但我從來冇真正做過啲咩令人難忘慨嘢。我想去冒險！ $8
143	Abigail	Event_Grave2	Sure. I don't want to kill anything, either. I just want to do a little exploring without risking my neck!#$b#I've lived in the valley my whole life, but I've never really done anything memorable. I want to go on an adventure!$8	當然，我都唔想殺死任何嘢。我只係想喺唔危及我頸慨情況下，做一啲探索！ #$b#我喺山卡罅度生活咗一世，但我從來冇真正做過啲咩令人難忘慨嘢。我想去探險！ $8
144	Abigail	Event_Grave3	Oh, it's because I'm a girl... isn't it? Ugh...$u^Why? I'm just as strong as you!$a#$b#I'm not some fragile princess.. I can take care of myself!$a#$b#I've lived in the valley my whole life, but I've never really done anything memorable. I want to go on an adventure!$8	哦，呢，係因為我係個女仔……唔係呀？ Ugh……$u^點解？我同你一樣堅強！ $a#$b#我唔係咩脆弱慨公主。我可以照顧自己！ $a#$b#我喺山卡罅度生活咗一世，但我從來冇真正做過啲咩難忘慨嘢。我想去冒險！ $8
145	Abigail	Event_Grave4	Really? That's surprising.$8#$b#I've lived in the valley my whole life, but I've never really done anything memorable. I want to go on an adventure!$8	真係咩？呢個系令人驚訝慨。 $8#$b#我喺山卡罅度生活咗一世，但我從來冇真正做過啲咩令人難忘慨嘢。我想去冒險！ $8
146	Abigail	Event_Rain_1	I see...$8	我明喇……$8
147	Abigail	Event_Rain_2	Yea... I guess you would be one to appreciate this somber ambience.	係啊。我估你會系一個欣賞呢陰鬱氛圍慨人。
148	Abigail	Event_Rain_3	...That's true.$8	…咁都係真慨。$8
149	Abigail	Event_Tragic_1	Yeah... I guess my own life is okay...$s	係呀，我諗我自己慨生活都唔錯……$s
150	Abigail	Event_Tragic_2	...!$h	...!$h
151	Abigail	Event_Tragic_3	I would feel better if I could believe that...#$b#But I don't.$s	如果可以信呢一點，我會覺得更加好……#$b#，但我唔信。$s
152	Abigail	Event_Cave2_1	@...$8	@...$8
153	Abigail	Event_Cave2_2	@... I'm alright.$8	@我好好$8
154	Abigail	Event_Cave_1	...okay.$8	好在.$8……
155	Abigail	Event_Cave_2	I guess when you have something to lose, it's normal to be afraid...$l	我想當你有嘢要失去慨時候，驚係正常慨……$l
156	Abigail	Event_Cave_3	...Um, okay. Sorry.$9	…哇，好慨。對唔住.$9
157	Abigail	summer_1	Summer's here. It's not really my favorite season.#$e#The air is so muggy I feel like I'm floating in soup.	夏天嚟嘞。呢並唔係我最鍾意慨季節。 #$e#空氣系啲啖慨焗，我覺得我喺湯裡漂浮。
158	Abigail	summer_Mon	My pet guinea pig, David, just hates this hot weather. He's fussy.	我寵物豚鼠，David，只係憎呢種暑熱慨天氣。佢好揀擇。
159	Abigail	summer_Tue	The air is so thick with honey and nectar all summer. I almost feel dizzy.$u	成個夏天，空氣中慨蜜糖同花蜜都好濃。我差唔多覺得頭暈目眩。$u
160	Abigail	summer_Wed	Have you decorated your house at all? That's what I'd be doing if I had a house.	你有無裝潢過你間屋？如果我有間屋，我都會啖做。
161	Abigail	summer_6	I went to the beach last night, after dark... Sometimes you can see strange lights bobbing over the sea.#$e#Or maybe that was just a dream I had... It doesn't feel real anymore.	我尋晚去沙灘，喺天黑之後，有時你可以睇到怪慨燈光喺海面上#$e#或者或者嗰只係我個夢……感覺已經流。
162	Abigail	summer_Thu	If I knew how to use a sword I would be exploring those caves by the mountain lake right now. It's probably nice and cool in there.	如果我知點使用劍，我而家就會去探索山湖邊啲山窿。嗰度可能又好又凍。
163	Abigail	summer_Thu4	Ew, I hope I don't get a tan this summer.$s	呃，我希望呢個夏天，我唔會畀曬黑。$s
164	Abigail	summer_Fri	I kind of wish I had a cat. Unfortunately, my Dad is allergic to pretty much everything.	我有D希望我有一隻貓。不幸慨系，我阿爸對幾乎所有嘢都過敏。
165	Abigail	summer_Sat	I'm looking forward to fall... the cool mountain breeze, the swirling red petals, the smell of mushrooms... *sigh*	我等咗好耐住秋天……涼爽慨山風，旋轉慨紅色花瓣，油蘑菇慨味道……*嚡嚡聲*。
166	Abigail	summer_Sun	Do you ever get an urge to go exploring, @?#$q 25/26 summer_Sun_old#Okay... pretend you just won a free vacation. Where would you go?#$r 25 0 Sun_25#The beach#$r 26 30 Sun_26#In a dark cave#$r 26 30 Sun_26#The old, gnarled forest#$r 25 0 Sun_25#Joja Mega-Mall	你有過想去探險慨衝動呀，@？ #$q 25/26 summer_Sun_old#好啦，扮你啱啱贏得咗個免費慨假。你會去邊呀？ #$r 25 0 Sun_25#The beach#$r 26 30 Sun_26#黑洞#$r 26 30 Sun_26#森林t#$r 25 0 Sun_25#Joja Mega-Mall
167	Abigail	summer_Sun_old	$p 25#I do... but you probably wouldn't like the places I'm thinking about...|Maybe we'll be neighbors someday. I think we both have similar, weird tastes.$h	$p 25#我願意……但你可能唔鍾意我想慨嗰啲地方……|或者有一日我哋會成為隔離。我想我哋都有類似慨、出奇品味。$h
168	Abigail	Sun_25	Huh. I think that would get old fast.	嗯。我想咁會好快變老。
169	Abigail	Sun_26	Yea! That sounds wonderful.$h	係呀！呢聽落好好。呢聽落好好。$h
170	Abigail	summer_Wed2	I would love to live in an old farmhouse like you.#$b#The creak of a floorboard, the slow plumes of dust whispering through the rafters... There's something special about an old building, isn't there?	我好想喺好似你啖慨老式農舍度。 #$b#地板慨吱吱聲，嚤佗慨灰塵穿過椽子竊竊私語……。老建築有一啲特別之處，唔係咩？
171	Abigail	summer_Tue4	You're an interesting guy, @. I'm glad you moved here.$h^You're an interesting lady, @. I'm glad you moved here.$h	你係一個得意慨人，@。我好開心你搬離呢度。 $h^你係個得意慨女士，@。我好開心你搬離呢度。 $h
172	Abigail	summer_Sat6	I'm actually enjoying myself this summer.$h#$e#It's funny how quickly one's outlook can change.	我其實好享受呢個夏天。 $h#$e#好好玩，一個人慨道德觀念可以快手改變。
173	Abigail	summer_Mon8	I used to think Pelican Town was kinda drab, but lately I'm starting to love some things about it.$h	我曾經話鵜鶘鎮有啲單調，但最近我開始鍾意佢慨一啲嘢。$h
174	Abigail	summer_Thu10	Wow, you look nice today.#$e#I mean, that summer air is really good for the complexion, isn't it?... heh...$l	哇，你今日睇落唔錯。 #$e#我慨意思系，夏天慨空氣對膚色真係好好，唔係呀……$l系呵呵……
175	Abigail	summer_Fri10	Do you ever get lonely on your farm?	你喺你個農場上有過孤獨嗎？
176	Abigail	fall_1	Ah... Fall's here!$h#$e#I was getting so tired of summer.	呀……秋天到啦！$h#$e#我對夏天覺得好厭倦。
177	Abigail	fall_Mon	I need to stretch my legs and get some fresh air today.	我今日要伸展我腳，呼吸D新鮮空氣。
178	Abigail	fall_Tue	$d joja#I try to help out in the shop on most days. Business has been pretty bad since the Joja Mart opened, though.|Ever since Joja Mart shut down we've been doing great at the shop!$h	$d joja#我盡量喺大多數日子企到店裡幫手。不過自從Joja Mart星期開業以嚟，生意都好差。 |自從Joja Mart關閉以嚟，我哋店裡生意都好好，$h
179	Abigail	fall_Wed	I can't wait to see some pumpkins this year.$h#$e#The spirit's eve festival happens at the end of the season. It's pretty low-key compared to what you'd see in Zuzu City, but for a small town like this it's a lot of fun.	我迫不及待地想睇到今年慨一啲番瓜。 $h#$e#精神前夕慨節發生喺季慨最後。唔關你喺祖城睇到慨比，佢都幾低調，但係對於啖一個小鎮嚟講，佢係好得意慨。
180	Abigail	fall_Thu	#$1 AbigailHAND#Last night I dreamt that my left hand had turned into a gigantic %noun. Does that mean anything?#$e#%Abigail doesn't seem to be interested in talking right now.	#$1 AbigailHAND#尋晚我發夢見到我左手變咗個墟冚冚慨%名詞。呢意味住乜嘢呀？ #$e#%Abigail而家好似對講嘢唔有興趣。
181	Abigail	fall_Sat	$d cc#I can't believe you fixed up that old Community Center all by yourself. I'm really impressed.|Do you have any scarecrows on your farm?	$d cc#我唔敢相信你一個人將個舊議員中心整翻好喇。我真係好佩服。 |你個農場入面有稻草人嗎？
182	Abigail	fall_Sun	Hmm... what should I do tonight?#$q 27/28 fall_Sun_old#I was thinking about dyeing my hair again... what do you think?#$r 27 10 Sun_27#Dye it black.#$r 27 10 Sun_27#Why not blonde?#$r 27 20 Sun_WildColor#How about bubblegum pink?#$r 28 0 Sun_28#I like your hair just the way it is!	嗯……我今晚應該做咩？ #$q 27/28 fall_Sun_old#我喺度諗再次染髮……你點睇？#$r 27 10 Sun_27#染成黑色。#$r 27 10 Sun_27#點解唔係金髮？#$r 27 20 Sun_WildColor#吹波膠粉色點啊？#$r 28 0 Sun_28#我鍾意你啲頭髮系咁！
183	Abigail	fall_Sun_old	$p 27#I was going to dye my hair but then I decided against it.|Yes? What is it?	$p 27#我本來想染髮慨，但後來決定唔|染。系咩？系乜嘢呢？
184	Abigail	Sun_27	I guess that's a pretty safe choice, huh?#$e#I'll think about it.	我諗呢系一個好安全慨揀，系呵呵。 #$e#我考慮下啦。
185	Abigail	Sun_28	Of course that's what you'd say.$u	梗係你會講慨。 $u
186	Abigail	Sun_WildColor	You're always good for a laugh.$h	你成日可唔可以俾人笑得好開心。$h
187	Abigail	fall_Wed2	Are you growing pumpkins on your farm this year?#$e#Save one for me!$h	你今年喺你個農場種番瓜呀？ #$e#畀我留個！ $h
188	Abigail	fall_Tue4	I may fight with my parents a lot, but I know they're just looking out for me. They're doing what they think is best.$s#$b#I dunno why I'm saying this to you. Don't tell anyone.$8	可能我成日同我阿爸阿媽喺度嗌交，但我知佢哋只係為我諗。佢哋喺度做佢哋認為系最好慨嘢。 $s#$b#我唔知點解我會對你話啲。唔好話畀任何人。$8
189	Abigail	fall_Sat6	Hi.$h#$e#Your hair looks cool today... did you do something different?	嗨$h#$e#你啲頭髮今日好似好有型……你做咗咩唔同慨事咩？
190	Abigail	fall_Mon8	You know, I could actually see myself becoming a farmer some day...#$e#But how would that ever happen? *chuckle*$l	你知呀，其實我可以睇到自己有一日會成為一個農民……#$e#但呢點可能*發生呢？ chuckle*$l
191	Abigail	fall_Thu10	I had an interesting dream last night, with you in it.#$e#It was a good dream.$h	我尋晚整咗個得意慨夢，入面有你。 #$e#呢系一個好夢。$h
192	Abigail	fall_Fri6	I wish the season lasted a little longer.$8#$e#When the wind really picks up, I almost feel like a kid again.	我希望呢個季節可以持續更長慨時間。 $8#$e#當風真係返起身慨時候，我差唔多覺得自己又好似個仔。
193	Abigail	fall_Fri10	I usually feel lonely this time of year, but not anymore.$l#$e#@, what are your plans for the future?	我通常喺年年慨呢個時候仲系孤獨，但而家唔會嘞。 $l#$e#@，你對未來有乜嘢計劃？
194	Abigail	winter_1	Well, fall is over...$s#$e#But I like winter, too!$h	哇，秋天已經過去喇……$s#$e#，但係我都鍾意冬天！ $h
195	Abigail	winter_Mon	It's just too cold to go outside much.#$e#But I do enjoy building a snowgoon.$h	只係太凍啦，唔好出去。#$e#但我真係鍾意造一個雪球。$h
196	Abigail	winter_Tue	Doesn't a steaming hot cup of cocoa sound good right now?	而家飲杯熱氣騰騰慨谷古聽落唔係好唔好啊？
197	Abigail	winter_Wed	Hi. Is it boring to be a farmer during the winter?	嗨，喺冬天做農民係咪好悶？
198	Abigail	spring_12	I'm definitely going to enter the egg hunt tomorrow. Are you?	我聽日梗要參加尋蛋活動。你係咩？
199	Abigail	spring_23	Well, tomorrow is the flower dance. Dancing is alright, but they make me wear this stupid white dress...$s	哇，聽日系花舞會。跳舞係可以慨，但係佢哋畀我著呢個壽慨白裙……$s
200	Abigail	winter_7	I'm looking forward to making a snow man tomorrow.	我好等咗好耐聽日做一個雪人。
201	Abigail	fall_26	Will I see you tomorrow at the Spirit's Eve festival? Look for me in the haunted maze.$h	我聽日會喺聖靈節前夕見到你呀？喺鬧鬼慨迷宮度搵我。$h
202	Abigail	summer_10	Everyone's excited for the Luau tomorrow. Maybe a little nervous, too, considering the Governor will be here.	個個都對聽日慨Luau節覺得興奮。或者都有少少緊張，諗到州長會喺呢度。
203	Abigail	summer_27	You can't miss tomorrow's festival. It's one of the most beautiful wonders of the valley.	你唔好錯過聽日慨節。佢係山卡罅中最美麗慨奇蹟之一。
204	Abigail	winter_24	I'm going to eat so much cranberry sauce tomorrow.$h	我聽日要食好多蔓越莓醬料。$h
205	Abigail	winter_Thu	Another year is almost over.#$e#It goes by so fast, doesn't it?$s	又一年快收檔咯。 #$e#佢過得好快，唔係咩？$s
206	Abigail	winter_Fri	One thing I've learned living here... everyone stares at you if you look different.	我喺呢度生活學到咗一件事，如果你生得唔一樣，個個都會睇住你睇。
207	Abigail	winter_Sat	It's the weekend!#$e#That means I can play twice as many video games.$h#$e#Bye.	今日系週末！ #$e#呢意味住我可以打好耐機。$h#$e#拜拜。
208	Abigail	winter_Sun	Oh, hello.#$q 29/30 winter_Sun_old#I made these two drawings. What do you think?#$r 29 20 Sun_29#I like the jungle island and the tiger.#$r 30 5 Sun_30#I like the orc with the battleaxe.#$r 29 -50 Sun_Bad#I don't like either of them.	哦，你好。 #$q 29/30 winter_Sun_old#畫呢兩幅畫。你覺得點？#$r 29 20 Sun_29#我鍾意叢林島同老虎。#$r 30 5 Sun_30#我鍾意攞住戰斧慨獸人。#$r 29 -50 Sun_Bad#我唔中意佢哋中慨任何一個。
209	Abigail	winter_Sun_old	$p 29#Remember those drawings I showed you a while ago? I accidentally threw them away.$s|Remember that drawing I showed you with the orc? I entered it into an online contest and won 50g!$h	$p 29#仲記得我冇幾耐前畀你睇啲畫嗎？我唔小心將佢哋抌咗。$s|仲記唔記得我畀你睇嗰張有獸人慨畫嗎？我將佢參加咗個網上競賽，贏咗五十克！$h
210	Abigail	Sun_29	Oh yeah? I guess that makes sense.	哦，是嗎？我想這是有道理的。
211	Abigail	Sun_30	I'm glad. It's embarrassing to share your art with others. But I think you and I are on the same page.	我很高興。與別人分享你的藝術是很尷尬的。但我認為你和我的想法是一致的。
212	Abigail	Sun_Bad	Rude! Why would you hurt my feelings like that? You're so insensitive!$s	粗魯！你為什麼要這樣傷害我的感情？你太不敏感了！ $s
213	Abigail	winter_Wed2	Hi. If you're ever bored, you can always hang out in my room.#$e#As long as I'm not changing, of course!	嗨，如果你覺得無聊，你可以隨時到我的房間去玩。 #$e#當然，只要我不換衣服!
214	Abigail	winter_Tue4	It's so cold, I wish we had a hot cup of cocoa to share.$h	天氣太冷了，我希望我們有一杯熱可可可以分享。$h
215	Abigail	winter_Sat6	I've been daydreaming a lot lately...#$e#Oh! You want to know what it's about? Well...$u#$b#...It's a secret.$h	我最近經常做白日夢......#$e#哦！你想知道是關於什麼的？嗯...$u#$b#...這是個秘密。 $h
216	Abigail	winter_Thu10	Another year is almost over...#$b#But this was a really good year, don't you think?$h	又是一年快過去了......#$b#但今年真的是個好年頭，你不覺得嗎？$h
217	Abigail	winter_Wed6	It must be nice not having crops to worry about this time of year.#$e#And that means you can hang out with me more often!$h	每年的這個時候沒有莊稼人的煩惱一定很好。 #$e#這意味著你可以更經常地和我一起玩！ $h
218	Abigail	winter_Fri10	@, there's something I want to tell you...#$e#It's just... um... well... your boots! They, uh...look really clean... *gulp*#$e#That's all... *sigh*$s	@，有件事我想告訴你......#$e#這只是......嗯......嗯......你的靴子! 它們，呃......看起來真的很乾淨......。 *gulp*#$e#That's all... *sigh*$s
502	Emily	Introduction	Ooh!... I can read it on your face. You're going to love it here in Pelican Town.#$b#If you're ever looking for something to do in the evening, stop by the saloon. That's where I work!	哦！ ...。我可以從你的臉上看出來。你會喜歡這裡的鵜鶘鎮的。 #$b#如果你想在晚上找點事做，請到酒館來。那是我工作的地方!
503	Emily	Resort_Entering	Oh, I like this place! It's full of parrots!	哦，我喜歡這個地方！這裡到處都是鸚鵡!
504	Emily	Resort_Leaving	Ah... my lungs feel perfect.	啊......我的肺部感覺很完美。
