958	Leah	winter_Sun	Do you ever take a whole day off?#$e#It's a refreshing break.	你曾經休息過一成日呀？ #$e#呢系一個令人振奮慨休息。
1078	Maru	Introduction	Oh! Aren't you the one who just moved in?#$b#I'm Maru. I've been looking forward to meeting you!$h#$e#You know, with a small town like this, a new face can really alter the community dynamic. It's exciting!	哦！你唔係岩搬嚟嗰個呀？ #$b#我係Maru。我一直喺度等咗好耐住見到你！ $h#$e#你知，好似啖慨小鎮，個新面孔真係可以改變議員慨活力。好畀人興奮！
1079	Maru	Resort_Entering	Willy mentioned that you helped fix the boat. Thanks for doing that!	Willy提到你幫手修船。多謝你啖做！
1080	Maru	Resort_Leaving	That was fun!	好好玩！
1081	Maru	Resort	I've been noticing a few different starfish species. My favorite are the big purple ones, but they're all very interesting!	我已經留意咗一啲唔同慨海星種類。我最鍾意慨系紫慨大海星，但係佢哋都好得意！
1082	Maru	Resort_Towel	*gasp*... It's a solar eclipse!$3#$b#Oh... nevermind. It's just your body blocking the sun.	*gasp*…呢係日食！!$3#$b#哦…算啦。呢只係你慨身體擋住曬太陽啫。
1083	Maru	Resort_Towel_2	We're so far removed from civilization out here.#$b#Imagine the stars you could see at night.#$e#Who knows, maybe we'd even see a flying saucer or two!$h	我哋喺呢度遠離文明。#$b#想像下你夜晚可以睇到慨星星。 #$e#點知呢，或者我哋甚至會見到一兩個飛碟！ $h
1084	Maru	Resort_Bar	Mmmm... Why are tropical fruits so good?	嗯…點解熱帶水果咁食？
1085	Maru	Resort_Shore	I wonder if Willy would let me bring my telescope here sometime...#The sky is so clear here, I bet I could spot Pelican Town out in the horizon.#Maybe I'd even see you running around %farm Farm!	我想知Willy會唔會畀我有時間帶住我望遠鏡嚟呢度……#呢度慨天系咁清晰，我打賭我可以喺地平線上睇到鵜鶘鎮。#也許我什至會看到你在 %農場到處跑!
1086	Maru	danceRejection	I'm flattered! But... No.	我真係受寵若驚！但係，唔好。
1087	Maru	divorced	We have nothing to say to each other.$a	我哋大家之間冇咩夠膽講話慨。$a
1088	Maru	breakUp	Not good enough for you, huh?$a#$b#Fine...$s	對你嚟講都唔夠好，哇？$a#$b#好啦……$s
1089	Maru	dumped_Girls	You've got some nerve, speaking to me!$a	你真係有膽，同我講嘢！ $a
1090	Maru	secondChance_Girls	You've lost some respect with me, @... but I'm willing to forgive you.$s	你喺我度失去咗一啲尊重，@……但我願意原諒你。 $s
1091	Maru	Mon	Whenever I'm struggling with a technical problem, I always take a walk.#$e#It's surprising how much a change of scenery can help.	每當我為一個技術問題而苦惱慨時候，我總係出去行下。 #$e#令人驚訝慨系，換個環境可有幾大幫助。
1092	Maru	Tue	Have you met my mother? She's the town's carpenter.	你見過我阿媽啊？佢係鎮上慨鬥木佬。
1093	Maru	Wed	On Tuesdays and Thursdays I work at Harvey's clinic.#$b#He says he likes having me around in case his medical equipment goes haywire!$h#$e#Being a farmer must be pretty easy, huh?	喺星期二同星期四，我喺哈維慨診所工作。 #$b#佢話佢鍾意有我喺身邊，以防佢醫療設備出錯！$h#$e#做一個農民一定好松，系嘛？
1094	Maru	Thu	I plan on spending a lot of time with my telescope this summer.	我計劃今年熱天花好多時間喺我望遠鏡上。
1095	Maru	Sat	Do you know my Dad, Demetrius? He's a scientist. I have a lot of fun helping him out in the laboratory.	你識我阿爸Demetrius嗎？佢係一個科學家。我喺實驗室度幫助佢有好多樂趣。
1096	Maru	Fri	Hey, sorry if I seem cranky... I'm a little sore from work yesterday.#$c .5# I had to carry ten boxes of medical files to the attic!#$e#I had to sort patient records for four hours straight!	嘿，對唔住，如果我好似好孟…尋日慨工作畀我有啲淵。 #$c .5#我要拎將十箱醫療文件搬閣上！ #$e#我要拎連續四個鐘對病人慨紀錄進行分類。
1097	Maru	Sun	Hi!#$q 3/4 Sun_01_old#Do you have fun working on the farm?#$r 3 0 Sun_01_01#Yes.#$r 4 0 Sun_01_02#No.	你好！#$q 3/4 Sun_01_old#你喺農場做嘢有樂趣呀？#$r 3 0 Sun_01_01#系慨。 #$r 4 0 Sun_01_02#唔好。
1098	Maru	Sun_01_old	$p 3#Hey, you've made another week of progress on the farm! It seems like things are going well for you.$h|Another tiring week on the farm, huh? It must really be a lot of work...$s	$p 3#嘿，你喺農場又取得咗一個星期慨進展！睇嚟你慨嘢進展順利。 $h|喺農場啲另一個禮拜好攰，系未啊？呢一定係個好大慨嘢……$s
1099	Maru	Sun_01_01	Well that's good, isn't it?$h	哇，好好，唔係咩？$h
1100	Maru	Sun_01_02	Yikes! I'm sorry. Have you ever thought of doing something different...?$s	呀！我好對唔住。你有冇諗過做啲唔同慨嘢……$s
1101	Maru	Tue2	Stop by our house when you need to upgrade your buildings.#$e#It's always nice to have visitors.	當你要升你慨建築物慨時候，唔該去我哋屋企。 #$e#有訪客係好好慨。
1102	Maru	Fri4	My mother is a carpenter and my dad is a scientist. I guess it makes sense that I'm into building gadgets.	我阿媽系個鬥木佬，我阿爸系個科學家。我諗，我鍾意建造小玩意係有道理慨。
1103	Maru	Mon6	Sometimes my head gets so cluttered with nonsense I can hardly think. Does that ever happen to you?#$e#Getting some fresh air usually helps.	有時，我腦子裡會畀垃圾嘢塞滿，幾乎唔諗。你有過呢種情況呀？ #$e#呼吸D新鮮空氣通常會有幫助。
1104	Maru	Wed8	I work at Harvey's clinic on Tuesdays and Thursdays.#$e#He's nice, but not really my type...	我星期二同星期四喺哈維慨診所工作。 #$e#佢好好，但唔係我中意慨類型……
1105	Maru	Thu10	Oh, @! Is there anything you want to talk to me about?$l	哦，@！你有咩想同我講慨咩？$l
1106	Maru	Event_Hospital_1	Of course he'll know the difference! This sample is completely ruined!%fork$s	佢當然會知道其中慨差別！呢個樣本完全被毀喇！!%fork$s
1107	Maru	Event_Hospital_2	Okay. I'll blame it on you, then.$u	好啦，咁我就將佢歸咎於你啦。.$u
1108	Maru	Event_Hospital_3	You're right. I should just tell him the truth.%fork$u	你係啱慨。我應該直接講畀佢聽真相。 %fork$u
1109	Maru	Event_Space1	It's amazing, isn't it?	好神奇，唔係咩？
1110	Maru	Event_Space2	I guess you could see it like that...$s#$b#But it's still incredible, isn't it?	我諗你可以啖睇…………$s#$b#但係都係好不可思議，唔係咩？
1111	Maru	Event_Cut1	Oh no?$8#$b#Well, that makes me feel a little better, then. Thanks.	哦，唔？ $8#$b#好啦，咁畀我覺得好啲啦，咁。多謝。
1112	Maru	Event_Cut2	Oh no! Aghh... I'm really really sorry.$s	哦，唔！丫，我真係好對唔住。$s
1113	Maru	event_robot1	Thanks. That means a lot to me, @.#$b#I know gadgets aren't really your kind of thing... but I do appreciate that you're showing interest in what I do.#$b#I wish I could return the favor somehow.$l	多謝。呢對我嚟講意義架。重大，@。 #$b#我知小玩意並唔係你菜，但我好感激你對我慨工作表現出興趣。 #$b#我希望可以以某種方式回報你。$l
1114	Maru	event_robot2	What? After she said point-blank that she doesn't want to be a slave? How cold...%fork$a	什麼？在她直截了當地說她不想做奴隸之後？多麼冷酷......%fork$a
1115	Maru	event_robot3	Heh...$8#$b#Yeah I guess he did kinda say that, didn't he?$l#$b#...Um...$l	Heh...$8#$b#Yeah I guess he did kinda say that, didn't he?$l#$b#...嗯...$l
1116	Maru	event_robot4	...$8#$b#@...$8	...$8#$b#@...$8
1117	Maru	event_robot_explain1	...$s#$b#You have a point, I did program her to act human... but her neural net is so complex, I can't be sure conciousness didn't emerge on its own.$8#$b#Furthermore, isn't it a little arrogant to assume that human-like consciousness is the only worthwhile vessel of existence? Computer brains are different than ours, but that doesn't mean we can disregard them.$8	...$s#$b#你說的有道理，我確實把她編程為人類的行為...但她的神經網絡非常複雜，我不能確定意識不是自己出現的。 $8#$b#此外，假設類似人類的意識是唯一有價值的存在容器，這是不是有點傲慢？計算機的大腦與我們的不同，但這並不意味著我們可以無視它們。$8
1118	Maru	event_robot_explain2	I see. Well it wasn't a very funny joke.$a	我明白了。嗯，這不是一個很有趣的笑話。$a
1119	Maru	event_robot_explain3	That's horrible! What's gotten into you, @?$a#$b#I'm just going to forget about this conversation... you aren't acting yourself.$a	太可怕了! 你怎麼了，@？ $a#$b#我打算忘掉這次談話......你不是在演戲。$a
1120	Maru	summer_1	This is going to be a great season for stargazing.	這將是一個觀星的好季節。
1121	Maru	summer_Mon	Hmm... What sort of gadget should I tinker with this summer?	嗯... 這個夏天我應該搗鼓什麼樣的小玩意兒？
1122	Maru	summer_Mon6	Come to my room if you ever want to tinker with my gadgets.	如果你想修理我的小玩意，就到我的房間來。
1123	Maru	summer_Tue	Sebastian is my half-brother, if you didn't know already.#$e#We look totally different.	Sebastian是我同父異母的兄弟，如果你還不知道的話。#$e#我們看起來完全不同。
1124	Maru	summer_Tue4	Sebastian hardly ever talks to me. I wonder if he even likes me at all?#$e#It's sad, I want to have a brother but he doesn't act like one.	Sebastian很少和我說話。我想知道他到底喜不喜歡我？ #$e#這很可悲，我想有一個兄弟，但他的行為卻不像一個。
1125	Maru	summer_Wed	Are you enjoying the season?#$e#It's been so warm this year.$h	你喜歡這個季節嗎？ #$e#今年的天氣很溫暖。$h
1126	Maru	summer_Thu	Sorry, I was just thinking about some gadgets I'm making.#$q 35/36 Thu_01_old#I've decided I'm going to build a robot someday.#$r 35 30 Thu_0#That should be very easy for you#$r 36 -50 Thu_01_01#You should be more realistic#$r 35 40 Thu_01_02#It sounds challenging	對不起，我只是在想我正在做的一些小玩意。 #$q 35/36 Thu_01_old#我決定有一天要造一個機器人。 #$r 35 30 Thu_0#這對你來說應該很容易#$r 36 -50 Thu_01_01#你應該更現實一些#$r 35 40 Thu_01_02#這聽起來很有挑戰性
1127	Maru	Thu_01_old	See you later.	回頭見。
1128	Maru	Thu_0	Really? Are you sure you're not just trying to flatter me?	真的嗎？你確定你不是在奉承我嗎？
1129	Maru	Thu_01_01	You don't think I could do it?$s	你認為我做不到嗎？$s
1130	Maru	Thu_01_02	You're right, but I love a challenge!$h	你是對的，但我喜歡挑戰！ $h
1131	Maru	summer_Sat	Hey, have any interesting farm stories to tell me?#$e#Guess not.	嘿，有什麼有趣的農場故事要告訴我嗎？ #$e#我想沒有。
1132	Maru	summer_Fri	I worked at the clinic yesterday. We didn't have a single patient.#$e#I guess people get sick less during summer.	我昨天在診所工作。我們沒有一個病人。 #$e#我猜人們在夏天會少生病。
1133	Maru	summer_Sun	I bet you're growing some interesting crops right now.#$b#Dad says a lot of exotic plants grow in the valley this time of year.	我敢打賭，你現在正在種植一些有趣的作物。 #$b#爸爸說，每年的這個時候，很多外來的植物都在山谷裡生長。
1134	Maru	summer_Fri2	Hey, tell me a story about farming.#$e#That's really interesting!	嘿，給我講一個關於農業的故事。 #$e#這真的很有趣!
1135	Maru	summer_Wed4	Is it just me or did it suddenly get really hot?#$e#I guess it's just me.	是我的錯覺，還是它突然變得非常熱？ #$e#我想這只是我的錯覺。
1136	Maru	summer_Sun6	Some day I'm going to be a world-class inventor.$u#$e#You're lucky to be friends with me!#$b#...just kidding.	有一天我將成為世界級的發明家。 $u#$e#你很幸運能和我成為朋友！ #$b#...只是開玩笑。
1137	Maru	summer_Tue8	@, you're looking sharp today.$h	@，你今天看起來很精神。 $h
1138	Maru	summer_Thu10	How do your hands stay so soft with all that farm work?	做了那麼多農活，你的手怎麼能保持這麼柔軟？
1139	Maru	fall_Mon	Have you explored the mines much? I've heard you can find some useful materials there.	你經常探索礦區嗎？我聽說你可以在那裡找到一些有用的材料。
1140	Maru	fall_Tue	The trees look beautiful today!$h	今天的樹看起來很美！ $h
1141	Maru	fall_Thu	In other parts of the world it's spring right now. Imagine that!	在世界的其他地方，現在是春天。想像一下吧!
1142	Maru	fall_Wed	Bleh... I don't feel like working tomorrow.	糟糕...。我覺得明天不想工作了。
1143	Maru	fall_Fri	I bet we'll start seeing more people at the clinic this season.$s#$e#I hope everyone stays healthy.	我打賭這個季節我們會開始在診所看到更多的人。 $s#$e#我希望每個人都能保持健康。
1144	Maru	fall_Sat	All these falling leaves will provide food for mushrooms and other small organisms.$u#$e#Interesting, isn't it?	所有這些落葉將為蘑菇和其他小生物提供食物。 $u#$e#有趣的是，不是嗎？
1145	Maru	fall_Sun	Hey, here's to another good week! *toast*	嘿，為另一個美好的一周乾杯! *敬酒*
1146	Maru	fall_Tue2	@, I just love how the trees look right now!#$e#I know you like them too.	@，我只是喜歡現在的樹的樣子！ #$e#我知道你也喜歡它們。
1147	Maru	fall_Wed4	If you have any extra metal laying around, I could always use it for one of my projects.#$e#But only if you don't need it yourself.	如果你身邊有多餘的金屬，我可以隨時用它來做我的一個項目。 #$e#但前提是你自己不需要它。
1148	Maru	fall_Fri6	I've been feeling especially optimistic lately...$h	我最近感覺特別樂觀...$h
1149	Maru	fall_Mon8	You should come visit me at the clinic Tomorrow. I work from 10 a.m. to 4 p.m.$h	你明天應該來診所看我。我的工作時間是上午10點到下午4點，$h
1150	Maru	fall_Thu10	You have a leaf in your hair. Let me get it for you.#$e#...$h	你的頭髮上有一片葉子。讓我來幫你拿吧。#$e#...$h
1151	Maru	winter_1	Oh man, it's so cold...$s	哦，伙計，太冷了...$s
1152	Maru	winter_Mon	Did you see the snowman I built?$h	你看到我堆的雪人了嗎？$h
1153	Maru	winter_Tue	My hair gets so frizzy in this dry weather. *sigh*	在這種干燥的天氣裡，我的頭髮變得很毛糙。 *嘆氣*
1154	Maru	winter_Wed	I guess winter is a good time to work on my gadgets.#$e#I wonder if I could make anything useful for farmers?	我想冬天是研究我的小玩意的好時機。 #$e#我想知道我是否能為農民做一些有用的東西？
1155	Maru	winter_Thu	Hey! What's up?#$e#It's a good time to explore the caves.#$e#I would go but my Dad would flip.	嘿!點呀?#$e#這是探索洞穴的好時機。#$e#我會去，但我爸爸會瘋掉。
1156	Maru	winter_Fri	I hope I don't catch the flu this year.	我希望我今年不會染上流感。
1157	Maru	winter_Sat	Have you built a furnace yet?#$e#You can use them to turn raw material like ores into more useful products.$u	你建了一個爐子了嗎？ #$e#你可以用它們把礦石等原材料變成更有用的產品。$u
1158	Maru	winter_Sun	I get so sleepy when it's cold...	天冷的時候我就很想睡覺...
1159	Maru	winter_Sat2	Hey, if any of your farming machines need to be fixed, just let me know.$h	嘿，如果你的任何農用機器需要修理，就告訴我吧！ $h
1160	Maru	winter_Tue4	Hey, do you have any ideas for a new gadget I can make?#$e#Mhmm. I trust your opinion.	嘿，你有什麼想法可以讓我做一個新的小工具嗎？#$e#我相信你的意見。
1161	Maru	winter_Fri6	You look fresh today. I guess it's that crisp winter air.	你今天看起來很清爽。我猜是冬天的清涼空氣。
1162	Maru	winter_Mon8	Hi @!$h#$e#Hey, don't you think my snowman looks kind of like you?	嗨@！ $h#$e#嘿，你不覺得我的雪人看起來有點像你嗎？
1163	Maru	winter_Thu10	@, come closer. I'm cold.$l#$e#My hands are so dry from the winter air. I'm sorry about that.$l	@，走近點。我很冷。 $l#$e#我的手被冬天的空氣弄得很乾。對此我很抱歉。 $l
1225	Penny	Introduction	Oh... Hello! I'm Penny...	哦......你好! 我是Penny…
1226	Penny	Resort_Entering	This island is so beautiful!	這個島太美了!
1227	Penny	Resort_Leaving	I had a great time.$h	我玩得很開心。 $h
1228	Penny	Resort_Shore	I'm a little embarrassed wearing my bathing suit in public.$s#$b#I hope no one's looking...$s	我有點不好意思在公共場合穿泳衣。 $s#$b#我希望沒有人在看...$s
1229	Penny	Resort_Shore_2	Somehow, the water here looks so different...#$e#I can hardly believe this is the same ocean I've been gazing at my entire life.	不知何故，這裡的水看起來如此不同......#$e#我很難相信這是我一生都在凝視的同一個海洋。
1230	Penny	Resort_Towel	The wind keeps making me lose my page, but it feels really great on the skin.$h	風一直讓我失去我的頁面，但它在皮膚上的感覺真的很棒。$h
1231	Penny	Resort_Towel_2	I'm reading a book about a sailor who washes up on a deserted island.#$b#I wonder what I would do in that sort of a situation?	我正在讀一本關於一個水手衝上荒島的書。 #$b#我想知道我在那種情況下會怎麼做？
1232	Penny	Resort_Marriage_Towel_2	Hey honey, do you mind standing a little to the left?#$b#Thanks, the sun was making it a little bit hard to read!$h	嘿，親愛的，你介意站在左邊一點嗎？ #$b#謝謝，太陽讓它有點難看！ $h
1233	Penny	Resort	This sand is so soft and fine. It feels great on my toes!$h	這沙子是如此柔軟和細密。它在我的腳趾上感覺很好！ $h
1234	Penny	Mon	Hi... #$e#Oh, did you want something?	嗨......#$e#哦，你想要什麼嗎？
1235	Penny	danceRejection	Oh... No, thanks.$s	哦......不，謝謝。 $s
1236	Penny	breakUp	...$s#$b#I... I see... *sniff* ... W... We can just be friends, then.$s	...$s#$b#我... 我明白了... *sniff* ... W... 我們可以只做朋友。$s
1237	Penny	pamHouseUpgrade	What you did for my family is so generous. Thank you!	你為我的家庭所做的一切是如此的慷慨。謝謝你!
1238	Penny	pamHouseUpgradeAnonymous	There are some truly wonderful people in the world...	世界上有一些真正優秀的人... ...
1239	Penny	dumped_Girls	I can't bear to see you...$s	我唔忍心見到你……$s
1240	Penny	divorced	...Please, leave me alone.$s	…請畀我一個人留住。$s
1241	Penny	secondChance_Girls	You've left a permanent scar on my heart, @. Still... I'm ready to speak to you again.$s	你喺我個心度留低咗個永久慨疓，@。即管咁，我已經準備好再次同你講野。 $s
1242	Penny	Mon4	*sigh*... My mother definitely has a problem with going to the saloon too much.$s#$q 7/8 Mon_old#But it's best not to dwell on bad things, right?#$r 7 50 Mon_7#Right. It's best to be positive!#$r 8 10 Mon_8#I think it's good to be realistic.	*sigh*…我阿媽肯定有問題，去沙龍慨次數太多。 $s#$q 7/8 Mon_old#但最好唔好糾纏於衰，對呀？ #$r 7 50 Mon_7#冇錯。最好系積極慨！ #$r 8 10 Mon_8#我認為真相啲係好慨。
1243	Penny	Mon_old	#$p 7#But if I keep trying I think I can get her to change.|I guess it makes sense. There's not much I can do to change it, anyway.	#$p 7#，但係如果我繼續努力，我諗我可以畀佢改變。 |我諗呢係有道理慨。咁我都冇咩可以改變慨。
1244	Penny	Mon_7	That's how I feel. I'm just going to focus on making the future better.	呢個系我慨感覺。我只係諗住將注意力擺喺畀未來變得更好。
1245	Penny	Mon_8	Maybe you're right. It's better to cope with reality.$u	或者你係啱慨。應對真相會更好。$u
1246	Penny	Mon8	I'm eager to move out. It's such a burden to be worrying about Mom all the time.#$e#I want her to be happy, but I can't stay here forever... you know?$s	我好想擔出去住。一直擔心阿媽系個負擔。 #$e#我希望佢可以快樂，但我唔可以永遠留喺呢度……你知道嗎？$s
1247	Penny	Tue	I'm tutoring Vincent and Jas today... They're a handful, but it's nice to make a difference in someone's life.	我今日要輔導Vincent 同 Jas ，佢哋好揦手，但可唔可以人哋慨生活帶嚟改變系件好事。
1248	Penny	Tue4	$d bus#Maybe now that my mother has her bus driving job back, I can start saving more money. Things are looking a little brighter.|I'm trying to save money from my tutoring job, but it's hard with my mother out of work.$s	$d bus#或者而家我阿媽恢復咗佢公交車做嘢，我可以開始存多啲錢。事情睇落更加明朗|喇。我喺努力由我家教工作中存錢，但我阿媽冇工作，好難。$s
1249	Penny	Tue10	Um, @? A farm seems like a good place for children, don't you think?$l#$e#It was just a thought I had.$l	哇，@？農場似乎系仔們慨地方，你唔覺得呀？ $l#$e#呢只係我個諗法。$l
1250	Penny	Wed	We don't have a school here but I'm doing my best to give Vincent and Jas a proper education.#$e#Every child deserves a chance to be successful.#$e#Jas is very good at math and reading. Vincent is good at... well, he has an active imagination!	我地呢度冇學校，但我喺盡力畀Vincent同Jas講嚇嘢喇！適當慨教育。 #$e#每個仔都應該有機會獲得成功。 #$e#雅斯喺數學同睇書方面十分出色。Vincent強項系…好啦，佢想像力好豐富！佢係一個好好慨仔。
1251	Penny	Wed2	You know what? I should take the children on a field trip some time. Maybe to the forest.#$e#A guest speaker would be nice... maybe someone familiar with nature?#$e#Sorry, I'm just thinking out loud.	你知道嗎？我應該揾個時間帶仔們去實地考量一下。或者係去森林。 #$e#一個客座演講者會好好，或者係熟自然慨人？ #$e#對唔住，我只係大聲諗。
1252	Penny	Wed4	I've lived in Pelican Town my whole life. Can you believe that?#$e#I guess there's a lot out there I'll never experience.	我喺鵜鶘鎮住咗一世。你可以唔信呀？ #$e#我想出便有好多嘢我永遠唔會經歷。
1253	Penny	Thu	We're very lucky to have a library in such a small town.#$e#When you're lost in a book, it's easy to forget the realities of your life.$u#$e#...Maybe that's why I like reading so much.$s#$e#...Sorry. I got carried away there.	我哋好好彩，喺咁個小鎮上有一個圖書館。 #$e#當你迷失喺書中慨時候，好容易唔記得咗你個真相生活。$u#$e#，或者呢就係點解我咁鍾意睇書。 $s#$e#…唔好意思。我喺度忘乎所以喇。
1254	Penny	Thu6	I wish I could keep a garden, but our yard is such a mess.$u#$e#Maybe I'll live in a place where I can have a garden someday.#$e#Maybe I'll live on a farm! *giggle*$h	我希望可以養個花園，但係我哋個院太亂。 $u#$e#或者有一日我會喺一個可以有花園慨地方。 #$e#或者我會喺個農場*咧？ giggle*$h
1255	Penny	Fri	If you dig in the dirt you can find some interesting things.#$e#One time I found a really old piece of pottery. I brought it to Gunther and he said it was over a thousand years old.	如果你在泥土裡挖，你會發現一些有趣的東西。#$e#有一次我發現了一件非常古老的陶器。我將佢畀岡特，佢話佢有一千多年慨歷史喇。
1256	Penny	Fri2	If you dig in the dirt you can find some interesting things.#$e#One time I found a really old piece of pottery. I brought it to Gunther and he said it was over a thousand years old.	如果你喺泥湴中挖掘，你可以發現啲有趣慨嘢。 #$e#有一次，我發現咗一張好古老慨慨陶器。我將佢畀岡特，佢話佢有一千多年慨歷史喇。
1257	Penny	Fri4	Dishes, dishes, dishes. Ugh... If my mother wasn't always nursing a headache from her late nights at the saloon, maybe she could help around the house a little.$s	洗碗，洗碗，洗碗。呃，如果我阿媽唔係因為喺酒館做到好夜而成日頭痛，或者佢可以喺屋企幫啲忙。$s
1258	Penny	Sat	This is such a small town. You can't avoid meeting everyone.#$e#I wonder what it's like to live in the city?	哩個細城鎮。你真係逃過與個個見面。 #$e#我想知喺城市入面系咩感覺？
1259	Penny	Sat2	$d Joja#Things changed a lot after the JojaMart went up. It's been really bad for Pierre's shop. Mom loves JojaMart, though. The prices are cheap, so she can afford a lot more there than she ever could at Pierre's.|Mom's been complaining ever since JojaMart closed down. I think it's good for her, though. Maybe she'll drink less Joja Cola now.	$d Joja#建成後，情況發生咗好大慨變化。呢對皮埃爾慨舖頭嚟講，真係好大鑊。不過，阿媽鍾意JojaMart。果度慨價錢好平，所以佢喺度買慨嘢比喺皮埃爾店裡買慨多得多。|但我認為呢對佢有著數。或者佢而家會飲少Joja可樂。
1260	Penny	Sun	Hello. Ummm...$u#$b#The weather's interesting today, don't you think?#$e#Sorry...$u	你好。呃……$u#$b#今日慨天氣好得意，你唔覺得呀？ #$e#對唔住……$u
1261	Penny	Sun4	I've been trying to keep our place clean, but it always gets messy again.$s#$e#It's hard to run a household all by yourself.$u	我不溜喺努力保持我哋慨地方清潔，但總系又變得，好亂。.$s#$e#一個人管理個家庭係好難慨。 $u
