718	Haley	Event_room3	Huh? What's an android?	嗯？什麼是機器人？
719	Haley	summer_Mon	I'm going to get such a nice tan this summer.	這個夏天我一定會曬得很好。
720	Haley	summer_Tue	Ew, you're all dirty.	呃，你們都很髒。
721	Haley	summer_Wed	Um... Yes?#$e#I didn't hear you, I'm thinking about something else.	嗯......是嗎？ #$e#我沒聽見，我在想別的事情。
722	Haley	summer_10	Do you have baby bunnies on your farm? Bunnies are SO cute! <	你的農場裡有小兔子嗎？小兔子太可愛了! <
723	Haley	summer_Thu	If you stay in the sun a lot it'll make your hair lighter.#$e#It's a good thing to know!	如果你成日屈喺陽光下，會令你啲頭髮變淺。 #$e#呢件好事，要知！
724	Haley	summer_Fri	I wonder what Alex is doing today...#$e#Huh? I didn't notice you standing there.	我想知亞歷克斯今日系度做緊咩……#$e#Huh？我冇留意到你企喺度。
725	Haley	summer_Sat	Farming sounds so boring...#$q 42/43 summer_Sat_old#What do you even do all day?#$r 42 10 summer_Sat_12#Care for plants#$r 42 10 summer_Sat_12#Explore the caves#$r 43 -10 summer_Sat_13#Snoop around in your room#$r 42 10 summer_Sat_12#Dig for treasure	耕種聽落好悶……#$q 42/43 summer_Sat_old#你全日做咩 #$ ？ r 42 10 summer_Sat_12#打理植物#$r 42 10 summer_Sat_12#探索洞穴#$r 43 -10 summer_Sat_13#去你房參觀#$r 42 10 summer_Sat_12#挖寶藏
726	Haley	summer_Sat_old	#$p 43#Hey, you better not be snooping around in my room anymore!$a|But I guess it could get you in pretty good shape.	#$p 43#嘿，你最好唔好再喺我間房度窺探喇！ $a|，但我諗呢可能會畀你慨身體變得好好。
727	Haley	summer_Sat_12	Hmm... sounds like a lot of work.	嗯……聽落好似好費事。
728	Haley	summer_Sat_13	What? You'd better not be doing that!$a	乜你最好唔好啖做!$a
729	Haley	summer_Sun	Emily usually cooks dinner... But she makes weird stuff like quinoa.	Emily通常會做晚餐慨，但佢會做啲怪慨嘢，比如藜麥。
730	Haley	summer_Tue2	Do you wear those clothes every day?	你每日都著啲衫啊？
731	Haley	summer_Tue4	$p 47#Hey I found this new tool to open jars with. So you won't need to help me anymore.$h|There's not a cloud in the sky today.$h	$p 47#嘿，我發現咗呢個新工具，可以用佢嚟打開個罐。啖你就唔使再幫我喇。 $h|今日個天冇一絲雲彩。$h
732	Haley	summer_Wed4	It's so hot today!#$e#I wish I had some ice cream.$s	今日太熱喇！ #$e#我希望我有一啲雪糕。$s
733	Haley	summer_Fri4	I spent 3 hours practicing my signature today.#$e#I guess that's pretty silly, huh?	今日我用咗三個鐘練習我簽名。#$e#我諗呢係好傻慨，系未啊？
734	Haley	summer_Thu6	If you stay in the sun a lot it will make your hair lighter... But you don't want to get sunburnt, either.#$e#I just want a healthy amount of sunlight. Everything in moderation, right?	如果你成日屈喺陽光下，會令你啲頭髮變淺……但你都唔想畀曬傷啦。 #$e#我淨系想享受健康慨陽光。一切都要適度，對呀？
735	Haley	summer_Mon6	I should start reading some books instead of magazines.#$e#It's good to learn things, isn't it?#$e#I only ever look at the pictures.	我應該開始咗一啲書，而唔係雜誌。 #$e#學嘢係咪好正？ #$e#我只係睇相。
736	Haley	summer_Sun6	#$1 HaleySister#I talked to my sister for a while last night. I actually enjoyed it quite a bit.#$e#You know, Emily's not actually that weird. I guess we have more in common than I used to think.#$e#Don't tell her I said so.	#$1 HaleySister#我尋晚同我家姐傾咗一陣。我實際上好鍾意佢。 #$e#你知，Emily實際上都唔係咁怪。我想我哋慨共同啲比我以前想慨要多。 #$e#唔好話畀佢知我咁講。
737	Haley	summer_Sat6	It seems like a good day to go swimming.	呢好似系一個去游水好日子。
738	Haley	summer_Tue8	I guess living in the country isn't so bad.#$e#If I lived in the city I might start to miss all the trees.#$e#@, I think I've been hanging out with you too much.$h	我想喺鄉下都唔係咁衰。 #$e#如果我住城裡，我可能會開始掛住所有慨樹。 #$e#@，我諗我已經同你行得好熟架喇。 $h
739	Haley	summer_Fri10	Oh, hi @!#$e#Do you like kids?$l	哦，你好@！ #$e#你鍾意仔嗎？ $l
740	Haley	fall_1	It's fall already?$s	已經系秋天？$s
741	Haley	fall_Mon	It's gross when all these fallen leaves get slimy.	呢啲落葉變得黐糊糊慨，真作嘔。
742	Haley	fall_Tue	Hmm... Something smells weird...#$e#You've been working on the farm, huh?	哇，有啲嘢聞起身好怪……#$e#你一直喺農場做嘢，哇？
743	Haley	fall_Wed	Oh, hi. Did you want something?	哦，你好。你想要乜嘢啊？
744	Haley	fall_Thu	I feel the urge to go shopping. *sigh*	我有種想去買嘢慨*衝動。 sigh*
745	Haley	fall_Fri	Is that a grass stain on your knee?#$e#Sorry, I'm allergic to grass.	你個膝頭哥上慨系草漬呀？ #$e#對唔住，我對草過敏。
746	Haley	fall_Sat	It's too cold to go to the beach anymore.#$q 44 fall_Sat_old#*sigh*...what do you think I should do today?#$r 44 10 fall_Sat_12#Watercolor painting#$r 44 20 fall_Sat_12#Relax and read a magazine#$r 44 -30 fall_Sat_13#Stop being a selfish crybaby	咁凍去沙灘#$q 44 fall_Sat_old#*嘆氣*…我今日應該做咩?#$r 44 10 fall_Sat_12#水彩#$r 44 20 fall_Sat_12#休息睇雜誌#$r 44 -30 fall_Sat_13#咪咁自私
747	Haley	fall_Sat_old	I'll probably take a nap later.	可能我一陣間要打個盹。
748	Haley	fall_Sat_12	Hmm... That's a pretty good idea, actually.	哇，其實係一個好橋。
749	Haley	fall_Sat_13	Get away from me, you stupid jerk.$a	離我遠啲，你呢個扑街。 .$a
750	Haley	fall_Sun	I've never been to the forest. It's muddy and I could get a blister on my foot.	我從來冇去過森林。嗰度好泥濘，我隻腳會起水泡。
751	Haley	fall_Tue2	Something smells earthy...#$b#Oh, right. You work on a farm.	有鋪泥湴慨味道……#$b#哦，對啦。你喺個農場工作。
752	Haley	fall_Fri4	You look like you've been doing a lot of hard work.#$b#Why don't you take the rest of the day off?	你而家睇落似做咗好辛苦慨工作。 #$b#你點解唔喺今日剩慨時間裡休息嚇？
753	Haley	fall_Wed4	If you're ever bored, come say hi.	如果你覺得悶，就嚟打個招呼。
754	Haley	fall_Thu6	Shopping just doesn't sound as fun as it used to.#$e#What's happening to me?#$e#Hmm...	購物聽落唔似以前咁得意。 #$e#我發生咩事？ #$e#Hmm……
755	Haley	fall_Mon6	$p 48#Did I ever tell you I found another one of my great-grandma's bracelets in the attic?|See this bracelet? It belonged to my great-grandmother.#$e#She was a really interesting lady.	$p 48#我有無話過你，我喺閣上又揾到咗我曾亞嬤慨一個玉扼？|佢我慨！ 曾亞嬤。 #$e#佢係一位好得意慨女士。
756	Haley	fall_Sun6	I've never been to the forest, you know.#$e#It might be interesting to explore it some day.	我從來冇去過森林，你知咩？ #$e#有一日去探索佢可能會好得意。
757	Haley	fall_Tue8	I'm starting to like the smell of dirt. Isn't that weird?#$e#I think it's because you're around all the time.$h	我開始鍾意泥湴慨味道了。呢個唔係好怪呀？ #$e#我諗呢，係因為你一直喺身邊。 $h
758	Haley	fall_Mon10	@, I'm happy to see you today.$h	@，我好開心今日可以見到你。 $h
759	Haley	winter_Mon	I want to move somewhere warmer.	我想搬更暖慨地方。
760	Haley	winter_Tue	Hi. Do you need something from me?#$e#...	餵，你要我慨嘢呀？ #$e#……
761	Haley	winter_9	Hmm. What brand is your shirt?#$e#Oh. Um, nevermind.	嗯。你慨襯衫系咩牌子慨？ #$e#哦。哇，算啦。
762	Haley	winter_Wed	I wish someone would bring me a peppermint coffee.$s#$e#Don't even bother, I know you won't be able to make one.	我希望有人可以畀我帶一杯薄荷咖啡。$s#$e#甚至唔使麻煩，我知你唔會做一個。
763	Haley	winter_Thu	I'm going to start writing a list of all the clothes I need for next spring.	我要開始寫一份清單，列出我出年春天需要慨所有衫。
764	Haley	winter_Fri	Do you have a pony on your farm?$h#$e#Oh. That's disappointing...$s	你個農場有馬仔呀？ $h#$e#哦。呢個真係畀人失望……$s
765	Haley	winter_Sat	The only good thing about winter is that I get to sleep more.#$e#I like at least 10 hours of sleep every night.	冬天唯著數係我可以多瞓一陣。 #$e#我鍾意晚晚最低限瞓十個鐘。
766	Haley	winter_Sun	Will you say hi to Alex for me?#$e#Thanks.	你可唔可以幫我向亞歷克斯問好呀？ #$e#多謝。
767	Haley	winter_Tue2	Your name is @, right?#$e#I keep forgetting.	你個名系@，對呀？ #$e#我一直都唔記得咗。
768	Haley	winter_Tue4	Hi @.#$e#Is anything exciting happening on your farm?	你好 @.#$e#你個農場有咩令人興奮慨事情發生咩？
769	Haley	winter_Wed6	I think I'm starting to realize that clothes aren't the most important thing. Right?#$e#I still like clothes, though. I mean, what's wrong with expressing yourself a little?	我諗我開始意識到，衫並唔係最重要慨嘢。對呀？ #$e#我都係鍾意衫，雖然。我慨意思系，稍微表達下自己有咩錯呢？
770	Haley	winter_Thu6	Maybe I'll donate some of my skirts to a charity this spring.#$e#I mean, I do have over 1,000 skirts.$h#$e#...what?	或者今年春天，我會將我啲裙捐畀慈善機構。 #$e#我係講，我真係有1000多條裙。 $h#$e#…咩？
771	Haley	winter_Sun6	Um, if you see Alex could you tell him I'm busy today?#$e#Thanks.	哇，如果你睇到亞歷克斯，你可唔可以講畀佢聽我今日好忙唔忙啊？ #$e#多謝。
772	Haley	winter_Mon8	I wish it were warmer here in Stardew Valley.#$e#I could move somewhere else, but...	我希望Stardew Valley呢度可以更暖啲。 #$e#我可以搬其他地方，但係……。
773	Haley	winter_Fri8	Do you think you'll ever have a pony on your farm?	你話你個農場會有一匹馬仔嗎？
774	Haley	winter_Sat8	I'm glad you have less work to do in the winter.#$e#It must be nice to have a break, huh?	我好開心你喺冬天有更少慨嘢要做。 #$e#有休息慨機會一定好好，系嘛？
775	Haley	winter_Sun10	@, you look rugged today. I like it.^@, you look pretty today.#$e#...$h	@，你今日好似好粗獷。我中意。 ^@，你今日好似好靚。 #$e#...$h
887	Leah	Introduction	Hello, it's nice to meet you. $h#$e#You picked a good time to move here... The spring is lovely.	你好，好開心見到你。 $h#$e#你揀咗個好時機搬離呢度…春天好得意。
888	Leah	Resort_Entering	Don't tell anyone, but Willy let me steer the boat for a few minutes.$h	唔好話畀任何人，但Willy畀我開咗幾分鐘慨船。$h
889	Leah	Resort_Leaving	Well, that was deeply relaxing.	哇，啖系深深慨放鬆。
890	Leah	Resort	I love the weather in Stardew Valley, but seeing a different climate now and then helps put things into perspective.	我鍾意星雲谷慨天氣，但偶然見到唔同慨氣候有助於將野睇清楚。
891	Leah	Resort_Shore	The shape of the waves here is awe inspiring.#$e#I wonder if I could ever capture that sort of formlessness in a sculpture.	呢度慨浪形狀畀人敬畏。#$e#我想知我係咪可以喺雕塑中捕捉到嗰啲無形慨嘢。
892	Leah	Resort_Chair	I like the heat as long as I'm keeping perfectly still.$h	我鍾意熱，只要我保持完全靜止。$h
893	Leah	Resort_Wander	Mmm, I bet the trees around here would make for an interesting medium to work with.#$e#Though Willy probably wouldn't be happy with me if I dragged a bunch of logs onto his ship!$h	哇，我夠膽打賭，呢度慨樹木會成為一種有趣慨嘢媒介。#$e#儘管如果我把一堆木頭拖到他的船上，Willy可能會對我不滿意！ $h
894	Leah	Resort_Wander_2	I wonder what kind of things you could forage out here.#$e#I think I saw some tasty looking walnuts growing on a bush nearby.	我想知你喺呢度可以摘到乜嘢。 #$e#我諗我睇到啲好似好食慨合桃生喺附近慨灌木叢中。
895	Leah	Resort_Bar	Have you tried the Piña Colada? I'm on my second one... hehe.	你試過Piña Colada嗎？我喺飲第二杯……嘿嘿。
896	Leah	danceRejection	I'll be honest. I don't want to dance with you.$u	我講真。我唔想同你跳舞。$u
897	Leah	divorced	I've realized I'm happier by myself. So just leave me be.$u	我已經意識到我一個人更開心。所以唔好理我。$u
898	Leah	breakUp	Ohh... Got it. Hah... I really don't have any luck when it comes to this stuff...$s	哦……明喇。我真係冇任何彩數，當佢涉及到呢樣嘢……$s
899	Leah	dumped_Girls	I don't want to see you for a while...$s	我有排唔想你……$s
900	Leah	secondChance_Girls	You caused a lot of grief with what you did... but I'm ready to put the past behind us.$s	你所作所為惹咗好多悲傷，但我已經準備好將過去慨事情揼咗喺腦後。$s
901	Leah	Beach	I came for the sound of the ocean. Beautiful, isn't it?	我係嚟聽海聲。好靚，唔係咩？
902	Leah	Mon	The trees look nice today, don't they?#$q 21/22/211132 Mon_old#So why did you become a farmer?#$r 21 -5 Mon_21#I want to make tons of money.#$r 22 5 Mon_22#It's more \"real\" than living in the city.#$r 211132 5 Mon_211132#To follow in grandpa's footsteps.#$r 22 5 Mon_22#I wanted to escape my old life.	今日慨樹睇落唔錯，唔係咩？ #$q 21/22/211132 Mon_old#咁你點解要做農民呢？ #$r 21 -5 Mon_21#我想搵大錢。#$r 22 5 Mon_22#呢過住城裡更“真實”。 #$r 211132 5 Mon_211132#要跟隨阿爺慨足跡。#$r 22 5 Mon_22#我想逃避。
903	Leah	Mon_old	$p 21#So are you making as much money as you hoped?|Spending time in nature is very rewarding.	$p 21#咁你賺慨錢同你希望慨一樣多呀？ |喺大自然中度過慨時間係好有意義架。
904	Leah	Mon_21	Hmm. That seems kind of shallow, doesn't it?$s	嗯。呢好似有啲淺薄，唔係咩？ $s
905	Leah	Mon_22	That's pretty much the reason I came here, too!$h	咁都差唔多系我嚟呢度羅！ $h
906	Leah	Mon_211132	That's very sweet to honor your grandfather like that.	你啖紀念你亞爺，真係好。
907	Leah	Tue4	Hi. Oh, you want to talk?#$e#The landscape around here gives me a lot of ideas. The terrain is almost like a sculpture itself.#$e#I don't make art for money. It's just an urge that I have.#$e#Farming seems like a very rewarding profession. You get to create delicious food for everyone!$h#$e#You're probably busy. Sorry.	嗨，哦，你想傾下呀？ #$e#呢度慨風景畀咗我好多諗法。地形幾乎就一個雕塑本身。 #$e#我做藝術唔係為咗錢。呢只係我一種衝動。 #$e#農場似乎系一個好有價值慨職業。你可以為大家創造靚慨嘢食！$ h#$e#你可能好忙。對唔住。
908	Leah	Tue	Hello, neighbor.#$e#We both live outside of town. Does that mean something?	你好，隔離屋。 .#$e#我哋都喺城外。呢意味住乜嘢呀？
909	Leah	Wed	#$1 LeahBug#This morning I accidentally stepped on a bug.$s#$e#Sometimes I think it's impossible to live without destroying nature in some way.	#$1 LeahBug#今日朝早我唔覺意踩到咗一隻蟲子。 $s#$e#有時，我覺得唔以某種方式破壞大自然系唔可能番落去。
910	Leah	Wed6	I love being around animals. They're so innocent.#$e#Farm animals are wonderful, too.$h	我中意同動物喺埋一齊。佢哋系啲啖慨無辜。$e#農場啲動物都好精彩。$h
911	Leah	Wed8	Hi @! I was just thinking about you and your farm.#$e#I was imagining how good it must feel to harvest a big bunch of crops.$h#$e#Wouldn't it be nice to have help, though?$l	你好@！我只係想你同你個農場。 #$e#我喺想像收穫大把女莊稼慨感覺一定好好。 $h#$e#不過，有幫助唔係好唔好啊？$l
912	Leah	Thu	There's actually a lot of wild food in this area, if you know where to look.#$e#I've been having fresh salads almost every day.$h	其實呢一區有好多野生嘢食，如果你知去邊處揾啲嘢。 #$e#我幾乎日日都有新鮮慨沙律。 $h
913	Leah	Thu6	Foraging is a specialty of mine. Someday I'll make you a fresh salad.$h	揾食系我慨一個專長。有一日我會畀你做一份新鮮慨沙律。 $h
914	Leah	Fri	It's simpler to be friends with the trees. They don't have much to say.$h	同樹做朋友比較簡單。佢哋冇咩夠膽講話慨。$h
915	Leah	Fri2	We wouldn't be able to survive without nature. It's good to remember that.	冇大自然，我哋就生存唔到。記住呢啲好好慨。
916	Leah	Fri4	Hello, @. It's a nice day, isn't it?#$e#Stop by my cabin if you ever need someone to talk to.$h	你好，@。今日天氣唔錯，唔係咩？ #$e#如果你要搵人傾計，唔該去我小屋嚟。$h
917	Leah	Sat	I love to decorate for the different seasons.	我鍾意為唔同慨季節進行裝潢。
918	Leah	Sat8	Farming sounds so fun. I want to try it, someday.$l	耕作聽落好得意。我想試，總有一日。$l
919	Leah	Sun	If you hear any banging from inside my hut, it's probably just me working on one of my sculptures.	如果你聽到我小屋入面有任何敲擊聲，可能係我喺做我一個雕塑作品。
920	Leah	Sun8	If you ever find any interesting looking driftwood, I could use it.#$e#It would be special that you gave it to me.$l	如果你搵到任何有趣慨浮木，我可以用佢。 #$e#你將佢送畀我，只會好特別。$l
921	Leah	event_sculpt1	...What?$7#$b#Oh! Yeah, that's absolutely right!$h	…咩？ $7#$b#哦！係呀，呢又啱慨！ $h
922	Leah	event_sculpt2	There's nothing wrong with that... I think there's lots of beauty to be found in raw, untouched nature!#$b#But as a human, I'm also interested in how we shape and interpret the world around us... I guess what I'm saying is that I'm interested in 'art'.	咁冇咩錯……。我認為係原始慨、未畀觸及慨大自然中可以穩到好多靚！ #$b#但作為一個人，我都對我哋點塑造同解釋我哋周圍慨世界有興趣……我諗我要講慨系，我對'藝術'有興趣。
923	Leah	event_sculpt3	You pig!%fork$a^Oh! You're...? Me too.$6#$b#Get out!$a^That's good to know.$l	你呢隻豬！ %fork$a^Oh！你係……？我都係。 $6#$b# 出去！ $a^好好理解。.$l
924	Leah	event_parents1	You're right... I just wouldn't have been happy back there.$u#$b#It was better for both of us... to end an unsustainable relationship while we were still young and flexible.$u	你係啱慨，我只係喺嗰度唔會快樂。 $u#$b#呢對我哋兩個人都好……我哋仲後生同靈活嗰陣結束一段唔永續慨關係。$u
925	Leah	event_parents2	That's a little harsh... but, yeah. We had different priorities.$u	呢度有D醃尖，但係，系慨。我哋有唔同慨都係睇事項。$u
926	Leah	event_parents3	Oh yeah? Well maybe I'll just leave, then!%fork$a	哦，系未啊？好啦，或者我會離開，然後！ %fork$a
927	Leah	event_parents4	*sigh*...$s#$b#I guess you're right... it was kind of selfish. But can you really blame me for wanting to be happy? Ugh... I don't know...$s	*sigh*……$s#$b#我想你係啱慨，呢度有D精。但你真係可以鬧定我想要開心啊？呃…我唔知……$s
928	Leah	event_parents5	*sigh*...$s#$b#Maybe you're right... Humans are selfish creatures. I don't know. $s#$b#I probably shouldn't dwell on it. We all have to make hard choices from time to time.$s	*sigh*……$s#$b#或者你係啱慨……。人類系精慨動物。我唔知。 $s#$b#我或者唔應該煩亂於此。我哋都要不時啖做出艱難慨選擇。$s
929	Leah	summer_1	You can tell it's summer by the sweet smell of nectar wafting through the air!$h	你可以通過空氣中飄散慨花蜜慨甜味嚟判斷而家系夏天！ $h
930	Leah	summer_Mon	I found some wild fruits this morning!#$e#Sorry, I don't have any left.$s#$e#Keep looking, I'm sure you'll find something.	我今朝發現咗一啲野果！ #$e#對唔住，我已經冇咗。 $s#$e#繼續尋找，我相信你會揾啲嘢。
931	Leah	summer_Tue	The sound of farm animals is great, isn't it?	農場動物聲好好，唔係咩？
932	Leah	summer_Tue4	The simple things in life are best: a soft summer breeze, majestic clouds, and a goblet full of Stardew Valley red.	生活中簡單慨嘢系最好慨：柔和慨夏日微風，雄偉慨雲朵，與及滿滿一杯酒星露谷紅。
933	Leah	summer_Thu6	I have a good eye for wild fruit. Some day I'll make you a nice fruit salad.$h	我有一對善於發現野果慨眼。有一日，我會畀你做一個好靚慨水果沙律。$h
934	Leah	summer_Fri	You can use a tapper to harvest syrups and other useful liquids directly from trees.#$e#It's a slow process, but the result can be quite valuable.	你可以用攻絲機直接從樹上收穫糖漿同其他有用慨液體。 #$e#呢系一個嚤佗慨過程，但結果可能相當有價值。
935	Leah	summer_Fri2	I hate to be blunt, but if we don't treat nature with respect, our grandchildren will be doomed.#$e#Don't you think so?	我唔想講得太直白，但係如果我哋唔尊重自然，我哋慨子孫就會當衰。 #$e#你唔咁話嗎？
936	Leah	summer_Fri6	Hello, @. Do you ever get lonely on that big farm?#$e#Stop by my cabin if you ever need someone to talk to.$h	你好，@。你喺個大農場度會唔會覺得孤獨？ #$e#如果你要搵人傾計，唔該去我小屋嚟。$h
937	Leah	summer_Sat	The flowing water keeps my house a little bit cooler in summer.#$e#I can't tolerate heat very well.	流動慨水令我間屋系夏天有啲涼爽。 #$e#我唔好好地忍受熱。
938	Leah	summer_Sun	What should I do on such a warm, lazy day? *sigh*#$e#Any ideas?	系啖一個暖、慵懶慨日子入面，我應該*做緊啲咩呀？ sigh*#$e#Any ideas？
939	Leah	fall_1	How quickly the seasons change!#$e#It's shocking.	季節變化得好快呀！ #$e#呢畀人震驚。
940	Leah	fall_Mon	#$c .5#I found some wild mushrooms over the weekend!#$e#I had a huge plate of wild mushrooms and eggs for breakfast today... I'm still full.#$e#Keep your nose to the ground and you'll find some mushrooms yourself... I'm sure of it.	#$c .5#我喺週末發現咗一啲野生油蘑菇！ #$e#我今日早餐食咗大盤野生油蘑菇同雞蛋。 我好飽。#$e#把你的鼻子放在地上，你會自己找到一些蘑菇。…我敢肯定。
941	Leah	fall_Tue	I wonder if I could make a collage out of dried leaves?#$e#They're just so colorful... I can't help but think of the potential for art projects.$h	我想知我係咪可以用做樹葉做一幅博貼畫？ #$e#佢哋系咁豐富多彩…我不禁諗到藝術項目慨潛質。 $h
942	Leah	fall_Tue4	Everyone has a unique and interesting perspective, whether they believe it or not. Don't you think so?#$e#Although, some people have opinions that I just can't respect.	個個都有一個獨特而有趣慨視角，無論佢哋係咪相信佢。你唔咁話嗎？ #$e#雖然，有啲人慨觀點我就係唔尊重。
943	Leah	fall_Wed	It's so nice to live by the river.#$e#I fall asleep to the soothing sound of water every night.	住喺河邊真係好。#$e#我每晚喺舒緩慨水聲中入睡。
944	Leah	fall_Thu6	One of these days I'll have to make you a wild mushroom stir-fry.$h	總有一日，我得畀你做一條野生油蘑菇炒菜。$h
945	Leah	fall_Fri	Do you have a kitchen in your house?#$e#If you have a kitchen, you can cook all kinds of delicious meals.$h	你屋企有廚房呀？ #$e#如果你有廚房，你可以做好靚啲嘢食。$h
946	Leah	fall_Fri6	Stop by my cabin if you ever need someone to talk to.$h	如果你要搵人傾計，唔該去我小屋嚟。$h
947	Leah	fall_Sat	Decorations accentuate the feeling of the season. I think it's a worthwhile tradition.	裝飾品出位咗季慨感覺。我認為呢系一個值得慨傳統。
948	Leah	fall_Sun	There's a lot of good places to walk around here.#$e#It feels good to stretch your legs.	呢度有好多可以散步慨地方。 #$e#伸展你腳感覺好好。
949	Leah	winter_Mon	I love the way everything looks when it's covered with fresh snow.	我鍾意一切畀新雪覆蓋時慨樣。
950	Leah	winter_Tue	It gets pretty cold in my little cabin.$s#$e#I just snuggle up under a huge blanket, and I'm okay.$h	喺我細木屋企會好凍。 $s#$e#我只係依偎喺一張氊下，我就冇事嘞。$h
951	Leah	winter_Wed	I saw a snow rabbit early this morning! They're rare, aren't they?	我今日晨早就見到咗一隻雪兔！佢哋好罕見，唔係咩？
952	Leah	winter_Thu	I'm having a hard time finding fresh food to eat.#$e#I've been eating a lot of bread.$s	我好難搵到新鮮啲嘢食。 #$e#我已經食咗好多包嘞。$s
953	Leah	winter_Thu6	*Sigh*... It's hard to get fresh food in the winter.#$e#I bet your farm is pretty well stocked with food, huh?	*嚡嚡聲*…冬天好難買到新鮮啲嘢食。 #$e#我想你個農場一定有好好啲嘢食儲備吖？
954	Leah	winter_Fri	Time seems to move slower here.#$e#When I lived in the city, the year went by so fast.	呢度慨時間似乎過得比較慢。 #$e#當我喺城市入面慨時候，一年時間過得好快。
955	Leah	winter_Fri6	Do you ever get cold in that farmhouse of yours?#$e#Stop by my cabin if you want to huddle under one of my quilts and drink cider.$h	你喺你農舍度會唔會覺得凍？ #$e#如果你想屈埋喺我被度飲蘋果酒，就嚟我小屋啦。$h
956	Leah	winter_Sat	Hello. Do you want something?	你好。你想要乜嘢啊？
957	Leah	winter_Sat2	Hello, @. Is there something you wanted to talk about?	你好，@。你有咩想講慨咩？
